{
     "id": 123,
     "version": 1,
     "skill_level_min": 800,
     "num_answers": 10,
     "curve_type": 3,
     "skill_level_max": 1000,
     "time_slices": 4,
     "retention_rate": 0.2,
     "cert": 1020,
     "corner_value_max": 100,
     "lfm_ts_recent": 10.5,
     "bands": 5,
     "corner_value_mid_1": 50,
     "lfm_ts_distant": 0.5,
     "confidence_bands": 5,
     "corner_value_mid_2": 5,
     "num_skill_levels": 5,
     "corner_value_min": 4,
     "max_rating_value": 740,
     "min_rating_value": 500,
     "skill_survey_score": 1,
     "resume_task_multiplier": 0.899,
     "history_duration_days": 65,
     "uvalues": "sdfsdfsdf sfsdfsdf----sdfdsf",
     "pvalues": "sdfsdfsdf sfsdfsdf----sdfdsf",
     "sum_coefficient": 1
}
